review,sentiment
"FIVE STAR FINAL was one of the best films of the early 1930s. It starred Edward G. Robinson and was a very gritty story about a sleazy newspaper and their willingness to do anything...ANYTHING to sell newspapers. In particular, an old story of an innocent woman is plastered across the pages and helps to destroy her now happy life--many years after she was inadvertently involved in a scandal. The reason I loved the film so much was that it was unflinching and pulled no punches--showing just how low the publishers can be to sell papers.<br /><br />Here in TWO AGAINST THE WORLD, it is a remake of FIVE STAR FINAL--with a few changes. Instead of Robinson, this film stars Humphrey Bogart and he is the head of programming at a radio station, not a newspaper. Otherwise, the story is essentially the same--except that it's a bit less edgy and lacks some of the grit and sensationalism of the original. This isn't to say the film is bad--it just doesn't pack quite as good a punch as the first film. In other words, if you must see one of these films, see the first--though this film is quite powerful and enjoyable as well. As for me, I loved the story so much, I saw both films and enjoyed them both.<br /><br />TWO AGAINST THE WORLD begins with the UBC radio owner complaining to his programming head (Bogart) that all the ""high brow"" shows he's put on are getting low ratings. The owner demands muck--lots of muck in order to get more listeners. One way they discuss is to do a multi-part dramatization of a famous killing that occurred two decades ago--even though the killer was acquitted and she killed only in self-defense. However, they decide to play up the story as if she was guilty and they even go so far as to both send a writer to the lady's home pretending to be a minister(!) as well as broadcasting her current name and whereabouts. Needless to say, this ruins the woman and leads to a horrible tragedy. Then, and only then, does Bogart feel any real remorse for producing such garbage--leading to a dandy finale about journalistic integrity and decency.<br /><br />Well-acted, a great story idea and a message that is just as important today as it was back in the 1930s, this is one story you have to see. In particular, notice the wonderful and very emotional confrontation scene where the daughter attacks the owner and Bogart---it is one heck of a great example of acting and writing.",1
"I may be biased, I am the author of the novel The Hungry Bachelors Club, self-published in 1994. The screenplay was written by my good friend and hungry bachelor, Fred Dresch, who was the inspiration for the character Marlon in the film. I couldn't be more pleased with the trailer, I hope to see the film in its entirety and I will further comment. But Jorja Fox, who plays Delmar Youngblood, my character, is stellar. She carries the bulk of the emotional vehicles in fine form. I couldn't have done better myself! This looks like real people, hardly formula driven and thankfully drives my statement against racial prejudice home, gracefully and heartfelt.",1
"Okay, I grew up on Who, but haven't loved a Doctor since Tom Baker. Christopher Eccleston made me love Who again and I'll be furious with him forever for leaving. <br /><br />The writing is grand, the acting superb, the directing (which was dreadful in the old days) is just fantastic. I was very skeptical about this programme, and watched it merely out of being forced, but am now a huge fan and love it (I have a ringtone of a Dalek screaming ""Exterminate"" then). <br /><br />A few of the things I love about the new programme -- 1) people actually notice when Rose (Billie Piper) disappears off the planet. Some of the old shows an assistant would drop off for a while, and then come home like nothing has happened, no one noticed. 2) Chris Eccleston's doc loves Rose -- romantic or not will be debated, but there is no doubt that 9 loves and cares about his companion. He'd destroy the world if he had to to save her, which the old show was lacking -- often a doctor wouldn't care if he never saw his assistants again. 3) They talk and think like real people -- when Rose is shown something outlandish or new (such as aliens) she acts like a real person would -- gobsmacked. I never liked it when an assistant from the old show, who never saw anything alien, would just fit right in and adapt instantly. I want to see the surprise on Rose's face when she sees a plastic dummy come to life. She gives that to me. <br /><br />The few things I don't like about this series: 1)nearly everything happens on earth (London or Cardiff) and I was sort of hoping for a more off-world sort of show. 2) That Eccleston left so quickly, he really made the show brilliant. <br /><br />But I can let those few things go -- I far more enjoy the series than I ever expected to, so I don't mind if they have stuff set on earth. <br /><br />Just don't take this show seriously -- it's fun, it's smart, it's entertaining, but it's not a super-serious heavy duty show. It's pure fun, and pure British, and I can't get enough. Watch it with an open mind, and just put your brain into neutral and enjoy!<br /><br />ps -- don't watch series 2 or later. series 1 was brilliant, the first few episodes of series 2 were good, but don't watch it once it gets to Love and Monsters. Utter rubbish, completely destroys the show.",1
"If you want to be cynical and pedantic you could point out that the opening where a RAF Lancaster bomber is mortally wounded on the 2nd of May 1945 is somewhat unlikely since German air defences were as lively as Adolph Hitler on that day but this isn't a movie that should be viewed by a cynical audience and I guess a character being killed in literally the last hours of the war adds to the poignancy . In fact you'd have to have survived the second world war to fully appreciate the intellect , beauty and soul of Powell and Pressburger's masterpiece . The scenes of heaven are painfully twee when viewed today ? Again you have to view the movie of the context when it was made . RAF bomber command lost 58,000 men during the war , the same number that America lost in 'Nam but during a shorter period and a far , far smaller pool of active combatants , there's no atheists in a fox hole and I doubt if you'd lost a relative during the conflict you'd view material atheism as being a sensible thing . When Richar Attenborough's young pilot looks down in awe at the sight below him many war heroes must have openly wept at this scene as they remembered much missed comrades who didn't survive the war . Also bare in mind that despite losing several million people from 1939-45 there seems to be very few people from Germany passing through the pearly gates . it's obvious Nazis don't go to heaven <br /><br />The plot itself where dashing young pilot Peter Carter arguing for his life in front of a celestial court wouldn't have had much appeal to me if it wasn't for the subtext , you see A MATTER OR LIFE AND DEATH is a highly political and visionary film that laments the end of the British empire as it's replaced by American ambitions . There's little things that show up the film as being made by people aware of American history and culture . One is the ethnic mix of America , even today many Britons think that the USA is overwhelmingly composed of White Anglo Saxon Protestants when in fact only 51% of Americans are "" White European "" . The film rightly contains a scene where a multitude of different races confess "" I am an American "" as Peter is judged by Abraham Farlan , an Anglophobe who was the first revolutionary killed by British forces in The American War Of Independence . As for the "" special relationship "" between Britain and America - What special relationship ? Powell and Pressburger know their history when it comes to Britain and America . They obviously know their future too <br /><br />So remember to watch this movie with some of your mind in the past and some of your mind in the present . It's strange , beautiful , poignant and clever but most of all it's a film that would never ever work if it were made in the last 40 years . Can you imagine if the story was set in 2003 and revolved around a British soldier killed in Iraq ?",1
"This movie is a true reflection of the Australian resourcefulness that has been required to make this country what it is over the last 200 years. Not pompous like the British, not Gung-Ho like the Americans. If either of those countries had attempted what this crew did, it would have failed dismally. Either due to ignorance on the British part, or too much faith in superior firepower on the American side. ""True"" Australians (i.e. non-imports) are the only ones who can excel in modern military conflicts because they have had to improvise most of their adult lives. Just look at examples like Gallipoli; Paschendale; Tobruk; New Guinea and Vietnam.",1
"The first film had little ambition so nothing sticks to the screen. It was a bad version of 'Back to the Future' with zero charm. Once accepted that Bill & Ted are nitwits, the joke can only get hammered at the audience for so long before it breaks.<br /><br />This is a surprise. This is your only spoiler warning...<br /><br />By today's standards, this is more fun. This was shunned upon release, sad considering that more talent is involved than the first time. We get the photographer of 'Face/Off', the editor of 'Fugitive', a production designer from Burton's early work, and the sound designer of 'Matrix'.<br /><br />The writers made up for their shallow first outing with something deep. Since this was shunned by the fanbase and public, the director probably decided the style was too extreme. It's not, it fits the material. Like 'Death Becomes Her' and 'Catch-22', this dares to be smart, but we like our movies ""simple"" so we don't buy it. Probably since this dared to be different is why it took 12 producers to pull it off. What's so good?<br /><br />--Nice self-reference towards Keanu; from airhead to Messiah. See also Arnold Schwarzenegger.<br /><br />--Joss hates his creations as much as he hates their counterparts, he makes his own hatred. The Evil B&T and the ""good robot usses"" have the same vocabulary as their originals: lesser copies and depreciation of language.<br /><br />--The ""duality"" motif. Nowhere else is this evident than in the photography styles, lots of high and low angles. They even use Roy Brocksmith from 'Total Recall' to emphasize the point.<br /><br />--The ""choices"" motif. I don't know where this started in the genre (maybe 'Ghostbusters'), but it's used pretty well here. It even boils down to the 7 games against death--Battleship and Club.<br /><br />--Film self-reference, even present in the game against Death (Clue). This is smarter than Tarantino or Brooks. Notice the Premier magazine cover at the end: ""Bill and Ted: The Movie."" Ironic also how Death and Nomolos were villains in the 'Die Hard' and 'Lethal Weapon' sequels.<br /><br />I still have some minor nits, but nothing compared to the original. Music and film are different mediums so it makes no sense why many scripts revolve around the former--particularly in the teen market. Carlin is a great comedian, but in these movies he's wasted. Also, for all the daring this effort shows, even cracking gay jokes, they can't kill a cat?<br /><br />So, despite looking like a Nickelodeon production, this is incredibly interesting. From this movie we got Beavis and Butt-Head. ""We're in Heaven and we just mugged three people."" <br /><br />Final Analysis = = Midrange Material",1
"This movie is a waste of time and money. Throughout the entire hour and a half, I continued to wait for it to get better and it never did. It was slow moving, the plot jumped around, it wasn't scary or interesting, and really never amounted to anything. The credits during the introduction were long and drawn out, which was basically like the rest of the movie (long and drawn out). Numerous parts of the plot made no sense. Several times during the movie I had thought that maybe I had ""zoned out"" because the incongruity of the plot, however, my companion had the same issue and assured me I did not ""zone out"" from boredom, but it was indeed the movie. I've actually never posted on here about a movie before and have been actively looking up movies on IMDb for numerous years. So the fact that I'm actually taking the time to write something should speak volumes of how bad this movie is and that you should not waste your time or money on it.",0
"Most movies I can sit through easily, even if I do not particularly like the movie. I am the type of person who recognizes great films even if I do not like the genre. This is the first movie I could not stand to watch. Cat in the Hat is the worst movie I have ever seen--and I've seen a lot of movies. The acting is okay (Myers is good as the cat, it's just that he is REALLY annoying). The silly songs the cat sings were boring and monotonous, even for the children in the audience. The plot drags on and on, and viewers must suffer through poor dialogue. The ""witty"" parental remarks are disgusting, not funny (I remember some awful comment about a garden hoe being compared to, well, a type of person people call a ""ho""). Even though the movie is really short, it seemed to last FOREVER. Do not waste your time. I know small kids who hated this movie. If children can't stand it, I do not know how any adults can. I would like to fume more about this film but I do not even feel like wasting anymore time writing this review about it. I HATED IT! So, in summary, do not spend 90 minutes of your life watching this! See a GOOD movie!<br /><br />1/10 stars--the lowest review I have ever given a movie.",0
"I'm hearing rumors of an upcoming ""Leonard Nimoy Demonstrates the Blu-ray Disc"". With advances over the past 25 years ranging from Steady-cam to CGI, it'll be interesting to see if the franchise can be reinvigorated. I just hope it helps to remove the bad taste left in my mouth by that whole Magnavision demonstration fiasco.<br /><br />And yes... ""Leonard Nimoy Demonstrates the Betamax VCR"" was a brilliant milestone in entertainment history. After the tentative ""Leonard Nimoy Demonstrates the Compact Cassette"" and the downright tacky ""Leonard Nimoy Demonstrates the 8-Track Tape"", who would have expected such a glorious piece of cinema? I'm weeping right now just thinking about it.",0
"It was very refreshing to watch this beautiful movie. The director maintained focus on the main subject without venturing into side plots (the doctor's family or stories of the other hospital patients), that are so typical of Bollywood assembly-line products. He kept the narrative simple to comprehend and made sure all the actors are true to the characters that they are supposed to portray. The rustic ways of the grandfather in the clinic, the cold and unemotional behavior of the surgeon, the zeal of the social worker gave the movie a feel of genuineness. I am also glad that the director did not fall for the temptation of adding songs or special effects and reduce it to the level of Anand or Safar. A couple of scenes toward the end of the movie, such as the boy visiting other blind children and a blind worker's workplace and also the final scene where the boy claps at the sound of splashing and birds chirping are sure make your eyes misty.<br /><br />Many Bollywood players do not realize that Oscar committee members value simplicity of the subject and genuineness and brevity of the movie more than the glitz and glamor. Shwaas is certainly a better nomination than Lagaan, which dealt with a subject that has already been beaten to death. No MPAA member is willingly going to suffer through 4 hours of jingoistic drama and a lot of song and dance.<br /><br />I look forward to more movies from director Sandeep Sawant in the future.",1
"I wish ""that '70s show"" would come back on television. It was the greatest show ever!!! They should make episodes between the other episodes but of course that would be confusing. But I wish it would come back and make more episodes. Please come back... The show was absolutely hilarious. You couldn't laugh without seeing an episode. There is a really funny part in every episode and plus the show was so much better when Hyde and Jackie were going out with each other. Those were the best episodes. ""That '70s show is the best"".... It will be and always will be the best show ever. It was really sad when the show ended. They should make new episodes.",1
"""9/11,"" hosted by Robert DeNiro, presents footage from outside and inside the Twin Towers in New York, on September 11, 2001.<br /><br />Never too grisly and gory, yet powerful and moving. ""9/11"" is a real treat. Anyone not moved by this television show is immune to anything.<br /><br />5/5 stars --<br /><br />",1
"Well...now that I know where Rob Zombie stole the title for his ""House of 1,000 Corpses"" crapfest, I can now rest in peace. Nothing about the somnambulant performances or trite script would raise the dead in ""The House of Seven Corpses,"" but a groovie ghoulie comes up from his plot (ha!) anyway, to kill the bloody amateurs making a low-rent horror flick in his former abode! In Hell House (sorry, I don't remember the actual name of the residence), a bunch of mysterious, unexplained deaths took place long ago; some, like arthritic Lurch stand-in John Carradine (whose small role provides the film's only worthwhile moments), attribute it to the supernatural; bellowing film director John Ireland dismisses it as superstitious hokum. The result comes across like ""Satan's School for Girls"" (catchy title; made-for-TV production values; intriguing plot) crossed with ""Children Shouldn't Play With Dead Things"" (low-rent movie about low-rent movie makers who wake the dead); trouble is, it's nowhere near as entertaining or fun. ""The House of Seven Corpses"" is dead at frame one, and spends the rest of its 89 minutes going through rigor mortis, dragging us along for every aching second...",0
"Treading Water is a very beautiful movie. I would put it straight under the wonderful short movie : Cosa bella from Fiona MacKenzie. It's not only about coming out but also about tolerance and acceptance in general. I am looking forward to seeing more of Laurel Himmel's work in the future. The actors, Angie Redman and Nina Landey are quite good. The main characters relationship could have been strenghtened a bit as we understand there is a very strong bond between them but maybe this could have been explained a bit. I am surprised that Angie Redman doesn't appear much in other movies. A great first step as a director for Laurel Himmel, I am sure there's more to see from her skills.",1
"Yes, it might be not historically accurate(actually only 6 soldiers of 9th rota were killed there), and yes, it has some mistakes and exaggeration(bended machine gun? come on! or the that ""history lesson"" about how Afghanistan was never conquered by anyone - educated Russian officer would know history much better than that - take for example British campaign in Afghanistan). And yes, it does not have multi-million dollars Hollywood-style special effects, but it's strongest point in showing soldier's life there, their relationships and their feelings when the best friends are being killed in front of their eyes. In my opinion 9ya rota really does a good job showing all those things.<br /><br />Again, movie has it weaknesses, but, in my opinion, it appears to be one of the strongest Russian movie for the past few years.<br /><br />8/10",0
"What a good movie! At last a picture revealing a unknown side of rock: illusions of fame. Well-known Rockers are getting old and forgotten, not the music. And with a good sense of humour. Have you ever danced on Bill Haley's Rock Around the Clock?<br /><br />Anyway, Still Crazy is probably the best movie about rock n'roll I have ever seen. Far much better than Spinal Tap for instance. Why? Because in Still Crazy, people are mature. They have a different point of view about rock, about love and about life. They want to catch up with their crazy youth they miss so much. Beyond the story itself, we see characters with their own personality, weaknesses and dreams. Like anyone of us.<br /><br />Spend a good time watching this (listen to the awesome soundtrack! )and finally thinking of your own future.<br /><br />Bye!",1
"Why is it that a woman cannot be a strong character in a movie without sleeping with the leading man? The campaign manager in this movie dreams of leading Tom Sellick to the White House. It's all she can think about. So, why on earth must she have had an affair with him? It added nothing to the plot and served only to demean successful women. The only value of that tidbit was the cute ""we've all slept with your husband"" scene. <br /><br />Also, couldn't the people who made this movie have watched the national conventions they were spoofing? Airing between the two major political conventions only served to highlight their total ignorance of the nomination and selection process.",0
"I guess this is the first movie that made me aware of the term ""cult flick"". It is totally a bad movie, but I can't help it, I like this movie. Richard Boone has made better and so has Joan Van Arc, but if you are in to staying up late and watching movies that don't make you think to much this one is for you.",1
"If I had never seen the first Road House, then I guess this movie might get one more star, but even then that makes it a 3 star movie. For that matter I was really surprised as to the relatively high rating it currently has.<br /><br />In reality, I was not able to finish this movie, as it was painful. Where it went wrong (at least the most obvious way) is that it pretty much parallels the original exactly even though the original plot is still referenced. This doesn't really make sense and doesn't work. Also, the acting is weak...I never felt like I was into the movie yet I felt like I was watching people act. Even good actors like Busey don't work out, probably due to the screenplay or maybe the awkward editing. The strangest thing is that the movie feels like a mid 90's B movie, yet is made in 06. I am not sure as to why, but then again, this often seems to happen with sequels for some reason. The music, the look, and the whole overall feel reminds me of movies you saw 10 years ago on Cinemax late at night. The strangest thing of all is that I am also expecting Ja Rule to come in at some point...often it reminds me of more current movies with rappers as actors.<br /><br />The most irritating thing is love interest girl who's character seems like a total rip off of the Lois Lane character on Smallville which is also quite annoying. And lets not forget the fakest sounding ""southern accents"" I have heard since Walk the Line. I realize this is common place in movies, but no accent at all would work better than attempting to sound like you are from that universal hick place on TV where anyone from any southern state (or KY and WV) sound exactly the same. Sure, people in desert towns in AZ sound just like people in Southeastern states 2000+ miles away. That was wearing thin 10 years ago in the B movies where technique came from. Why do writers / directors make such decisions? <br /><br />Bottom line: I would truly not recommend this if you are a fan of Road House or if you like good movies. Also, if you have not seen it yet, don't spoil it by seeing this version first. The original Road House was one of those accidental classics that people love and watch over and over. It was an unexpected success like American Graffiti, Dazed and Confused, and more recently Office Space, Fast and Furious (only the first one!), and Napolean Dynamite. Why did they spoil it!!!???<br /><br />They should have never made a sequel to Road House other than a high budget version with the right actors / director. Sure, you can never top the original (ex: Bad News Bears, The Longest Yard, etc.), but at least if you can do it right it will be presentable as is the case with the examples I mentioned. But to make a low budget, off-network, self production of Road House is criminal.",0
"My 15 year old daughter asked me to watch this movie with her on Cable TV. As someone who saw Revenge of The Nerds in a movie theater, I found this movie to be an extremely predictable remake of it. The Nerds were simply replaced by Dorks. I drove her crazy by being able to predict precisely what would happen in each scene. The cast was cute, especially Amanda Bynes.<br /><br />Screenwriter Chad Creasey should be ashamed for writing such an obvious remake of an early 1980's flick. The title should have simply been ""Revenge of The Dorks."" Perhaps the sequel will be Revenge of the Dorks 2.",0
"Based on one of the books by Gabriel Marquez and it might be brilliant literature, this cinema-adaption really sucks as it's more like fighting against sleep rather than enjoying some cinematographic delices. The story is about an old couple whose son died and living a life that is heavily dominated by poverty, and wherein the main character is a cock that hopefully one day brings some money for a forthcoming cockfight. I am in no mood to spill more words on this useless pretentious piece, just perhaps that you can see Salma Hayek in here, but sitting 90 minutes in front of your screen for just that? No gracias.....",0
