review,sentiment
"This happens to be one of my favorite horror films. It's a rich, classy production boasting an excellent cast of ensemble actors, beautiful on-location cinematography, a haunting musical score, an intelligent and novel plot theme, and an atmosphere of dread and menace. It's reminiscent of such classic films as ROSEMARY'S BABY and THE SHINING, wherein young, vulnerable women find themselves victimized by supernatural forces in old, creepy buildings with a macabre past. Here, CRISTINA RAINES plays a top New York City fashion model named Alison Parker. Her happy, outgoing exterior masks a deeply conflicted and troubled soul. This is evidenced by the revelation that in her past, she attempted suicide twice- once as a teenage girl after walking in on her degenerate father cavorting in bed with two women and having him rip a silver crucifix from her neck and toss it on the floor, and the second time, after her married lawyer-boyfriend's wife supposedly committed suicide over learning of their affair. Telling her beau(played by a suitably slimy CHRIS SARANDON) that she needs to live on her own for a year or so, she answers a newspaper ad for a fully-furnished, spacious one-bedroom apartment in an old Brooklyn Heights brownstone. This building actually exists and is located at 10 Montague Terrace right by the Brooklyn Heights Promenade off Remsen Street. The producers actually filmed inside the building and its apartments, paying the residents for their inconvenience, of course. The real estate agent, a Miss Logan(AVA GARDNER), seems to be very interested in having Alison take the apartment- an interest that cannot be solely explained by the 6% commission she would earn. Especially when she quickly drops the rental price from $500.00 a month to $400.00. Alison agrees and upon leaving the building with Miss Logan, notices an elderly man sitting and apparently staring at her from the top-floor window. Miss Logan identifies the man to her as Father Halliran and tells Alison that he's blind. Alison's response is very logical- ""Blind? Then what does he look at?"" After moving in, Alison meets some of the other residents in the building, including a lesbian couple played by SYLVIA MILES and BEVERLY D'ANGELO, who provide Alison with an uncomfortable welcome to the building. Alison's mental health and physical well-being soon start to deteriorate and she is plagued by splitting headaches and fainting spells. When she relays her concerns to Miss Logan about her sleep being disturbed on a nightly basis by clanging metal and loud footsteps coming from the apartment directly over her, she is dumbstruck to learn that apart from the blind priest and now herself, no one has lived in that building for the last three years. Summoning the courage one night to confront her nocturnal tormentor, she arms herself with a butcher knife and a flashlight and enters the apartment upstairs. She is confronted by the cancer-riddled specter of her dead father and uses the knife on him in self-defense when he comes after her. The police investigate and find no sign of violence in that apartment- no corpse, no blood, nothing. Yet Alison fled the building and collapsed in the street, covered in blood- her own, as it turns out. But there's nary a mark on her. What Alison doesn't realize until the film's denouement is that her being in that brownstone has a purpose. She was put there for a reason- a reason whose origin dates back to the Biblical story of the Garden of Eden and of the angel Uriel who was posted at its entrance to guard it from the Devil. She is being unknowingly primed and prepped by the Catholic Church to assume a most important role- one that will guarantee that her soul, which is damned for her two suicide attempts, can be saved. At the same time, the ""invisible"" neighbors, who turn out to be more than just quirky oddballs, have a different agenda in mind for her. This is a competent and intelligently done film and one that surprisingly portrays the Church and its representatives in a mostly sympathetic light.",1
"The movie actually has a fairly good story, but gets bogged down in several key places. It's almost as if the director threw the movie together without taking the time to make some essential cuts in the film. Dennis Quaid does a fairly decent job in his role... but something is clearly missing from several key scenes.<br /><br />This 2.5 hour movie could have been reduced to about a 2 hour movie. And probably would have been a much better film had it not had the feel as if it was thrown together.<br /><br />",1
"This isn't ""so bad it's good""--It's ""so bad, it violates the Geneva Convention's prohibition on cruel and unusual punishment""! Only by reading the Synopsis can you even figure out the ""plot"" of this Straight to Video disaster. It's a hodge-podge of grainy stock footage spliced together with some of the all-time worst acting you'll ever have the misfortune to see. Comparing this incompetent, turgid, humorless mess to ""Dead Men Don't Wear Plaid"" is like saying that ""Gigli"" is like ""Citizen Kane"". The talentless cast are costumed in cheap, J.C. Penney ""Goin' to Church"" clothes, and there isn't the slightest attempt at period hairstyles or make-up. If you really want to see how this sort of ""homage"" can work, check out ""The Lost Skeleton of Cadavra""--It's clever, well-written, and best of all, performed by actual actors who aren't such agony to watch. For that matter, seek out the work of Phoenix artist Paul Wilson whose Sci-Fi short ""The Attack of the 70 foot Courtesy Lady"" leaves this film in the dust. The people in Terror In the Tropics look and sound like they were pulled off the street and given their scripts to read during the one and only take. This is an insult to Bela Lugosi, Boris Karloff, Lon Chaney, and anyone else involved in the films they cannibalized to make this schlock-fest! Money isn't the problem--A lot can be accomplished with very little expense. A good script, decent actors, and above Z-Grade costumes and production design should have been a given before the so-called director created this stinky pile of cinematic offal. Let's hope the ""promise"" of a sequel doesn't come true--That was by far the scariest thing shown in the whole movie!!",0
"A cheesy ""B"" crime thriller of the early '50, the story is droll, the characters wooden, Allison Hayes and Abbe Lane are the only two sexpots that make it an eye-catcher, but one short shot, only a few frames long, shows an ""el"" train crossing the river on the State Street bridge, of the 6000 series Pullman-built cars painted in their original 1950 paint scheme, as they were delivered when new in 1950. For traction fans like me, that one short take makes the picture worthwhile. I think films like this one, Ulmer's DETOUR, D.O.A. with Edmund O'Brien,THE FUGITIVE with Harrison Ford, and others of the film noir genre, (big city crime dramas) make it interesting if for nothing other than the fact that I know Chicago and San Francisco intimately and recognize most of the street locations. Other wise it's a really droll boring film!",0
"As hard as it is for me to believe, with all of the awful reality shows out there over the past few years, this one has to take over the top spot for worst one yet. I am still wondering if this was actually just a spoof done by the SCTV gang. If Andy Kaufmann were still alive I'd be sure he was behind this. Can a rock band stoop any lower than has INXS to do such a shameful thing as this? The premise is simple and moronic. Audition a bunch of karaoke rejects to become the new lead singer of INXS, to take the place of Michael Hutchence (who committed suicide in 1997). Eight years and no hits later, the band commit the ultimate act of patheticness by subjecting themselves to auditioning a bunch of talentless wannabes to be the new lead singer of a band that is 20 years past its prime. So they trot all of these awful singers (I thought American Idol had its share of doozies) who do atrocious renditions of just about every classic (and predictable) rock song imaginable. And then they cut to the INXS band members who are seriously discussing the merits of each of these candidates. You could see better (and more original) rock performers at just about any night club in any city in the world.<br /><br />It has all the usual uncreative elements of every other reality show. Lame reality participants, lame interviews, lame host/emcee, lame ""judging"" of performances, and the lame booting of one participant at the end of each show. Can these shows get any more predictable? It's clearly a publicity stunt on the part of the band; a last gasp of hope at rekindling their lost stardom before they are finally buried into oblivion. Michael Hutchence, if he had any shred of dignity when alive, has to be rolling over in his grave. Not that INXS were ever a great band, but I had no idea they were this pathetic. If INXS are at all representative of what rock and roll has become, this show would be the final proof that rock and roll is once and for all, dead.",0
"As Americans, we have come to expect crapiness as ""par for the course"" when it comes to HORROR and unknown directors directing unknown actors acting for unknown writers. We truly expect this to suck & when they don't suck,it becomes an over night success.<br /><br />This is NOT an over night success, nor is it an over the weekend or over the month success. This blows from start to finish and my only recommendation is this: GO INTO THIS KNOWING IT SUCKS, enjoy it for what it is, for what it isn't & if you have something better to do, keep this on the back WAY BACK burner. It's entertaining in the way watching the elderly cross a busy street during rush hour, but don't expect much-they almost never get hit by an actual car, its just a lot of hoopla.",0
"I'm working my way through the Horror Classics 50 Movie Pack Collection and THE MAD MONSTER is one of the movies in the set.<br /><br />I am sure that George Zucco was a good actor; but, this was only the second film in which I saw him, the first being DEAD MEN WALK, in which he played two parts. However, even good acting couldn't save THE MAD MONSTER.<br /><br />Zucco plays a mad scientist, Dr. Cameron (who was banned from academia because of his unethical and inhumane experiments). He believes that he can control evolution by bringing out the characteristics of one animal into another.<br /><br />In this case, like so many others of its ilk, it is a transfusion of (I assume) wolf's blood into humans. His goal is to create an invincible army, which he can control through the antidote. The subject of his experiments is his hired hand, a retarded gardener, whose dialogue slows down this snail-paced classic to almost a full-stop. <br /><br />Beyond his experiments, Dr. Cameron also plots revenge on those who discredited him, using his transformed gardener. However, he loses control of his subject, who begins to transform without the transfusion -- yikes! <br /><br />The werewolf transformations are classic Hollywood stop-action / makeup effects. No doubt these were groundbreaking techniques of the time; but, in today's digital age it's hard to imagine audiences being scared by this.",0
"Hugh (Ed Harris) is a hotshot, bachelor senator determined to run for president. One day, however, he happens upon an old high school classmate named Aggie. Aggie (Diane Keaton) is an accomplished and award-winning author with a lovely face and an independent spirit. Hugh is smitten. He convinces Aggie to become his fiancé. But, will Aggie have to sacrifice her principles of honesty in the world of politics, where things are not always what they seem to be? And, will she be able to withstand the rigors of a harsh media blitz? This is, mostly, a nice romance for those who adore tales of affection. Hugh and Aggie are absolutely in love and their banter and conversation are a good view. However, although the movie tries to show the political life in its reality, it doesn't completely succeed. Nevermind. The production values are high and the script is very elegantly written. With these advantages and the handsome personages of Keaton and Harris, those who sit down to the film will find it to be good entertainment.",1
"I was excited to discover this late sixties comedy staring some of my favorite people - Maggie Smith, a very young Bob Newhart and, of course, Peter Ustinov. My disappointment was thus compounded to discover the film doesn't work as either a comedy or a perfect heist film. Ustinov plays a small time crook just out of prison who sets his sites on a large American corporation based in London. Bluffing his way past dimwitted CEO Karl Malden and tech geek Newhart, Ustinov passes himself off as a computer expert and immediately plans the 'perfect heist' part of the film. To do this he needs to get passed a tamper proof security system that guards the corporation mainframe. And here is problem one. His perfect plan only works because everyone else in the film is remarkably trusting and stupid. His lame excuses are taken at face value and this must be the only computer center anywhere not to bother with video cameras. The second problem is the heist (fraud really) happens within the first 30 minutes of the film robbing the rest of the picture of much in way of dramatic tension. Maggie Smith is sadly miscast as Ustinov's ditsy next door neighbor/secretary who just can't keep a job. I love Maggie Smith but she just seems too together here, too composed, the part called for more of a wacky, physical comedian. Furthermore, Ustinov and Smith have no chemistry together, maybe it's the age difference, but the later romantic relationship, as devoid of actual romance as it is, still comes off a little creepy. Ustinov co-wrote the script, and it was thought well of at the time, but I found it unfunny, meandering and a sad waste of a great cast.",0
"The story-line of ""The Thief of Bagdad"" is complex, owing to its being told in flashbacks and having three separate and equally important strands woven together. The screenplay by Lajo Biros and the dialogue by Miles Malleson keep the story moving skillfully at all points.The young King Ahmad of Bagdad is angry at his vizier Jaffar for executing a man for having different ideas. He discovers while in disguise that people blame him for Jaffar's deeds and hate him. He is imprisoned by Jaffar, where he meets Abu the young thief. The two escape and take a boat to the city of Basra. There the companions spy when men clear the way so none will see the Princess of the city passing by. Ahmad falls in love with her and visits her in her garden. He tells her he has come to her from beyond time and wins a kiss. Then he is captured. When Jaffar comes to win the Princess of Basra for himself, Ahmad attacks the evil vizier who blinds him and turns Abu into a dog. Jaffar then asks for the Princess's hand, and he gives the gift of a mechanical flying horse to the Sultan of Basra. The blind Ahmad then tells his tale in the marketplace, accompanied by Abu as his dog. The Prince has fallen into a sleep and nothing can wake her. So Jaffar sends his servant Halima for Ahmad and the dog, in hopes the prince can rouse her. He does awaken her. She boards a ship to find a doctor to cure Ahmad, but she is captured by Jaffar who then throws the dog overboard. She then allows Jaffar to take her in his arms, on his promise to restore Ahmad's sight and turn Abu back into a thief. The princess sees a vision of Ahmad; he is in a boat; Jaffar sends a storm to beset him and Abu is shipwrecked on a deserted island. Abu finds a genie or djinn who wants to kill him now that he is free after many centuries spent imprisoned in a bottle. Abu tricks him into proving he really came from so small a vessel, then corks him in again. For freeing him, he gets three wishes. His first is for sausages. In the meanwhile, the Princess pleads with her father to refuse Jaffar; but Jaffar shows the Sultan a new mechanical toy, one of whose six arms stabs him to death. Abu makes a second wish, to find Ahmad. The cunning genie flies him to the goddess of the All-Seeing eye. Abu has to climb a great web to get to the gem that is the eye, battling a giant spider, then scaling the goddess's statue. Abu gazes into the 'eye' and sees Ahmad in a canyon. He has the genie take him to Ahmad. Ahmad uses the eye to see the princess. She smells a flower and forgets everything at once. Abu wishes they were in Bagdad, but the genie laughs and leaves; Jaffar tells the Princess that she is in love with him, omitting mention of Ahmad. Ahmad tries to fight his way to the Princess, but Jaffar smashes the 'eye'. Abu finds himself in the ""Land of Legend"", where the old men who rule want to make him their king. He steals a bow and a magic carpet and escapes instead, to hurry to save Ahmad and the princess. The thief arrives in time to save the young king from the executioner, using his bow from the flying carpet, to the wonder of the throng who had come to watch the execution. Jaffar tries to flee on the mechanical flying horse, but another shot from the bow finishes him. Ahmad is ruler again and plans to wed his Princess; but when he tries to make Abu his vizier, the young thief refuses, saying that what he wants is adventure, not hard work and confinement in a palace however grand it may be. This fantastic story was given a sumptuous production by producer Alexander Korda. The production was designed by Vincent Korda who was also art director, while Georges Perinal did the colorful cinematography. The directors credited are Ludwig Berger and Michael Powell, with Tim Whelan, Alexander Korda, William Cameron Menzies and Zoltan Korda participating. The extraordinary and numerous costumes designs were the work of John Armstrong, Oliver Messel and Marcel Vertes. The production, apart from its gorgeous and expensive-looking visual splendors, I claim is dominated by two other elements, the choral music of Miklos Rozsa and the performance by Conrad Veidt as the evil Jaffar. Rex Ingram plays the genie with a curious accent, plus his usual intelligence and power. June Duprez is lovely and effective as the Princess Mary Morris is a sad and beautiful Halima, and Miles Malleson a properly bumbling and avaricious Sultan. As Ahmad, John Justin appears to do most of what can be done with the part of a young prince in love and then some; he is memorably good in his winning role. This film has a spaciousness about it that is found, I assert, in other Korda works also. Its imaginative content stands in contrast to very-strong realistic sets, costumes and set-design elements. This is one of the most memorable idea-level fantasies of all time, worthy to be enjoyed over and over.",1
"Like his early masterpiece ""The Elephant Man"" Lynch proves to his detractors that he can tell a straight, simple story without losing his artistic touch. This is a true story of an elderly retired man (expertly played by Richard Farnsworth) who decides to ride a tractor across a few states to pay a final visit to his estranged brother who now stands at death's door. A beautiful score from Badalamenti, exquisite photography of rural life (love those aerial corn-field shots), and a sly director's hand that reveals man's basic humanity, this is a beautiful slice of life film. Its extremely slow pace may lull some viewers to sleep, but those who stay for along for the ride will be well rewarded in the end.",1
"When I reviewed the video for a local magazine, I called it ""the greatest achievement in the history of the American cinema."" That was not wholly tongue in cheek. TW&TL remains Milius' best work, and it's sad that he has so little opportunity to work anymore. However, TW&TL remains a striking exposition of what once was known as The American Character, largely on the strength of Brian Keith's superb portrayal of Teddy R. (Obviously Milius--and Keith--admired TR tremendously to make two films about him, including ""The Rough Riders."") It's hard to fault this film at any level: a splendid balance of action, levity, relationships, and the serious topic of America coming of age in the world. Furthermore, TW&TL has exceptional appeal across the board: note the stats showing it rates best with under-18 males, females 18-29, and over 45! Clearly Candy Bergen struck a responsive chord with women as well as men.",1
"I was very lucky to see this film as part of the Melbourne International Film Festival 2005 only a few days ago. I must admit that I am very partial to movies that focus on human relations and especially the ones which concentrate on the tragic side of life. I also love the majority of Scandinavian cinematic offerings, there is often a particular deep quality in the way the story unfolds and the characters are drawn. Character building in this film is extraordinary in its details and its depth. This is despite the fact that we do encounter quite a number of characters all with very particular personal situations and locations within their community. The audience at the end of the screening was very silent and pensive. I am still playing some of those scenes in my mind and I am still amazed at their power and meaningfulness.",1
"This independent, B&W, DV feature consistently shocks, amazes and amuses with it's ability to create the most insane situations and then find humor and interest in them. It's all hilarious and ridiculous stuff, yet as absurd as much of the film should be, there is a heart and a reality here that keeps the film grounded, keeps the entire piece from drifting into complete craziness and therein lies the real message here. This film is about how we all survive in a world gone mad. That seems to be the heart of the film. For as insane and off the wall as things get, Leon, the 30 yr. old paperboy-protagonist, always tries to keep it together. He's like a child forever trying to catch the balloon that is floating away so that everything will work out for the best, so that everyone can have what they want.<br /><br />The acting in the film could have went far over the top but the exceptional cast really keeps the piece cohesive. Van Meter is perhaps the best of the bunch here with a performance that shines through her absurd diseased tics. Just as the characters in the film do, we overlook her sudden outbursts to see the real person underneath. <br /><br />Majkowski is a true genius here. He takes the utmost ridiculous plot twists and keeps them real. It is his script and his cast that help keep the whole thing afloat. It's a true testament to the skill of Majkowski and all involved that this film, with it's grating plot and characters, never once works our nerves. Majkowski has taken a film that could have been abrasive and repugnant, and somehow given it heart and humor. This is a unique film. Not to be missed. <br /><br />",1
