review,sentiment
"Written by brilliant Monkees' TV writers Gerald Gardner and Dee Caruso,WHICH WAY TO THE FRONT was the last of the ""Jerry Lewis"" movies until ""Hardly Working"" almost a decade later. Jerry's comedy is evidently an acquired taste, and admittedly he can occasionally be his own worst enemy when he helms as producer/director--but even in the dreariest of his films, there are always moments of brilliance.<br /><br />WHICH WAY manages to be amusing,entertaining and yes,quite funny. It is somewhat unlike any of the typical Lewis films.The pace is very upbeat and ther are lots of excellent supporting players--a kind of JERRY DOES HOGANS HEROES.The whole thing looks kind of like an unsold TV pilot and you will either love it or hate it---but hopefully YOU VILL LAUGH",1
"In the same way Lamberto Bava was a substandard facsimilie of his father, Mario (who was an extremely overrated director anyway), Michele Soavi is a substandard director in the Dario Argento mold. ""The Church"" has at least one thing to recommend it--the incredibly detailed art direction--but absolutely nothing else. The film is long-winded, filled with one-dimensional characters, and almost put me to sleep several times. There's a fine line between 'art' and 'pretentious crap,' and while ""The Church"" isn't completely worthless, you'd be better off watching something else.<br /><br />3/10",0
"Just like all of Mel Brooks' other comedies, Men in Tights is hilarious. But in seeing this as an outrageous comedy, I think many fail to realize that the reason the movie is so funny is that the characters themselves are acted so well. Elwes is the well-spoken former British noble, Lewis is an eternally annoyed king (I hope it's worth all the NOOOOOOIIIISE!), DeLuise is a FANTASTIC godfather, Roger Rees is a worried and cynical sheriff.... The actors and actresses are so loyal to their parts that the jokes flow forth with ease. Yes, we've seen this kind of comedy before, but the only comedy to achieve better character development, in my opinion, is The Big Lebowski. Very very funny.",1
"I have never seen a movie that annoyed me that much. It is a movie about stupid people that are doing stupid and terrible things. This is not a funny movie. I must say that the plot line is awful. I did not had patience to watch it so that i only saw half of it, but it was enough for me. The characters are not very inspired. Just terribly annoying. This movie is all about a goofy guy trying to hook up with his tyrannous boss's daughter. When he finally manages to talk to her, she asks him to go at that night at her home to watch her father's owl, and he thinks she had invited him to go with her at a party and to be at her home at 6 pm. He gets to be very disappointed finding out that he only has to take care of the owl and that she has a boyfriend. After her father leaves home leaving precise orders, about taking care of the house and his beloved bird, appears a secretary, a renegaded son and all sort of NOT funny stuff happens in the house. But he finally hooks up with his boss's daughter. TRUST ME THIS MOVIE IS TERRIBLE!!!!!!!!!!!!",0
"This movie was the worst movie I have seen since ""Date Movie."" I was laughing through out the whole movie instead of being scared. It was funny how the snakes would search for particular section of the passengers body to attack for example, the eye, the tongue, the butt, the breast. If we have seen national geographic channel we know snakes wont stay clinched on the body once they bite. For each particular scene the snakes would bite the passengers and would stay on the body biting the person. I believe the producer did not study his information on snakes and their behavior. I cant believe I wasted my money on this movie.So I don't recommend this movie trust just wait until it is at the dollar theatre or rent it.",0
"I had completely forgotten about ""Midnight Madness"" until just now when I found it while surfing the IMDB. Now, it's all coming back to me....<br /><br />It was one of Naughton's first movies (as well as Fox's) and sharp-eyed connoisseurs will also pick out Kaplan (Henry from TV's ""Alice""), Fiedler (he does the voice of Piglet in the ""Winnie the Pooh"" cartoons) and Blocker (son of Dan ""Hoss"" Blocker from TV's ""Bonanza"").<br /><br />But the two that stand out in my mind are Furst (from ""Animal House"") and the superdude himself - Eddie Deezen. Furst plays a baddie this time out and has one of the best scenes when he asks his dad, ""Why can't you just accept me for who I am?"" His dad looks over his obese, slovenly frame and gives a simple, one-word response - ""Yuck!""<br /><br />And Deezen... well, he's a show in himself. As a latter-day Jerry Lewis he stumbles around, wades through mini-golf ponds, puts melon halves on his ears and ends up having Maggie Roswell fall for him. My hero.<br /><br />As for the film, it's typical early-'80s stupidity with college kids staying up after curfew and going on a city-wide scavenger hunt to prove which division of students is the best on campus: the jocks, the nerds, the rich kids, the feminists or the group made up of a little of each. <br /><br />Who wins? Who cares, you'll have a lot of fun watching Disney Pictures' first foray into PG territory before creating Touchstone Pictures.<br /><br />Seven stars. Catch ""Midnight Madness"" any way you can!<br /><br />Long live Leon!",1
"No, no, no, no, no, no, NO! This is not a film, this is an excuse to show people dancing. This is just not good. Even the dancing is slow and not half as entertaining as the mediocre 'Dirty Dancing', let alone any other good dance movie.<br /><br />Is it a love story? Is it a musical? Is it a drama? Is it a comedy? It's not that this movie is a bit of all, it's that this movie fails at everything it attempts to be. The film turns out to be even more meaningless as the film progresses.<br /><br />Acting is terrible from all sides, the screenplay is definitely trying to tell us something about relationship but fails miserably.<br /><br />WATCH FOR THE MOMENT - When Patrick Stewart enters the scene and you think the film might get better as he brightens up the dull atmosphere. For a second.",0
"I enjoyed the previous Ittenbach movie that I'd seen, ""Burning Moon"". But while that movie was rather grim and nasty, ""Premutos"" seems to mostly play it for laughs. While its admirable how Ittenbach made this movie with no money in his spare time (and the DVD documentary is worthwhile to see this), I found myself constantly battling not to fast-forward to the next gore scene. Sure, there's gore, and if that's all you want then go ahead and enjoy. But be warned: there's an inordinate amount of lame comedy and tedious story exposition. Many are comparing this to Peter Jackson's movies, especially ""Braindead"". But looking at what Jackson did on a similar budget in ""Bad Taste"", it's clear Ittenbach is lacking one thing that Jackson has - talent. 3/10 (for pretty good and plentiful gore effects, and for getting the most out of limited resources - but not worth the money I paid for it)",0
"A widely unknown strange little western with mindblowing colours (probably the same material as it was used in ""Johnny Guitar"", I guess ""Trucolor"" or something, which makes blood drips look like shining rubies), nearly surrealistic scenes with twisted action and characters. Something different, far from being a masterpiece, but there should be paid more attention to this little gem in western encyclopedias.",1
"Only Connery could bring that particular style with a line like that Fatima crashes into Bond's arms when she water-skis up to the super agent in Nassau and apologizes, 'Oh, how reckless of me. I made you all wet.' The super agent replies, 'Yes, but my martini is still dry.'<br /><br />Barbara Carrera makes a great villain, stealing the show as SPECTRE executioner Fatima Blush Fatima is number 12 in the SPECTRE chain of command, and is a gorgeous assassin who takes intense sensations of pleasure in killing <br /><br />Fatima assumes all the deadly characteristics of Fiona, proving to be one of Bond's toughest adversaries She is a victim of her vanity She's good at what she does, and wants the world to know it But her vanity is her downfall Using every possible approach to eliminate 007, Fatima is a wild and cunning woman who makes love to the man she is about to kill <br /><br />Austrian actor Klaus-María Brandauer (Largo) does not make a very formidable opponent for 007 Referred to as number one in the SPECTRE chain of command, Largo resides in the Bahamas, and travels aboard his super yacht, the Flying Saucer <br /><br />Max Von Sydow becomes the fourth actor to appear as SPECTRE chief Ernst Stavro Blofeld, once more plotting to put the world at ransom <br /><br />Kim Basinger takes the part once owned by the lovely French actress Claudine Auger She is Domino, the mistress of Largo, who soon falls deeply in love with her rescuer <br /><br />Black actor Bernie Casey becomes the sixth actor to play CIA agent Felix Leiter after Jack Lord, Cec Linder, Rik Van Nutter, Norman Burton, and David Hedison...<br /><br />Edward Fox portrays the new, unsympathetic 'M.' Pamela Salem is the third actress to play Miss Moneypenny. Lois Maxwell was the first and Barbara Bouchet was the second.<br /><br />Valerie Leon is the sexy lady in the Bahamas who fished 007 out of the blue water and saved his life by making love to him in her own room Valerie was the Sardinian hotel receptionist in 'The Spy Who loved Me' when Bond and Anya arrive seeking Stromberg<br /><br />Prunella Gee is Shrublands physical therapist Patricia Saskia Cohen Tanugi is Nicole, Bond's Secret Service contact in the South of France <br /><br />Gavan O'Herlihy is Jack Petachi, the U.S. Air Force communications officer who duplicates the President of the United States' 'eye print' and arms two cruise missiles with nuclear warheads <br /><br />Rowan Atkinson is the bumbling foreign officer Nigel Small-Fawcett; and Alec McCowen is Algernon, the armorer who provides 007 some formidable items <br /><br />If you like to see Connery playing a tense battle of wills, disguised as a masseur, attacked by robot-controlled sharks, giving away a considerable amount of money for a tango dance, thrown into a medieval dungeon, don't miss this second of only two ""unofficial"" James Bond films",1
"These days, Ridley Scott is one of the top directors and producers and can command huge sums to helm movies--especially since he has films like ALIEN, GLADIATOR and BLADE RUNNER to his credit. So from this partial list of his credits, it's obvious he's an amazing talent. However, if you watch this very early effort that he made while in film school, you'd probably have a hard time telling that he was destined for greatness. That's because although it has some nice camera-work and style, the film is hopelessly dull and uninvolving. However, considering that it wasn't meant for general release and it was only a training ground, then I am disposed to looking at it charitably--hence the score of 4.<br /><br />By the way, this film is part of the CINEMA 16: European Shorts DVD. On this DVD are 16 shorts. Most aren't great, though because it contains THE MAN WITHOUT A HEAD, COPY SHOP, RABBIT and WASP, it's an amazing DVD for lovers of short films and well worth buying.",0
"This is one horror movie based TV show that gets it right. Friday the 13th the series had no connection to the movies. Poltergeist the legacy: I'm not so sure. It may have been loosely connected to the movies. It feels like they just throw a famous title on a show so fans will watch it.<br /><br />It shows Freddy being burned by the Elm street parents(in the 1st episode I believe) and the amount of parents were disappointing. With all the kids he targeted in the 1st 3 movies, you'd expect there to be more parents. But oh well.<br /><br />Freddy is basically the narrator for the show. He watches the actions of people in the real world sometimes getting involved somehow. Just like other anthology shows like Tales from the crypt, there's a supernatural or surprise ending twist involved.<br /><br />The acting lacks but believe it or not: the violence sometimes surpasses that of the movie. This show lasted a couple of seasons and was made around the time of the 4th movie. i heard it was canceled due to protesting parents. I watched a lot of R rated stuff as a kid, so its a shame parents had to ruin it for everyone. 4 more movies came after the series , so it wasn't a total loss.",1
"I agree with most of the Columbo fans that this movie was an unnecessary change of format. Columbo is a unique cop with unorthodox police methods. This movie looks like a remake of any other ordinary detective dramas from the past. And that is the disturbing point, because Columbo is no ordinary detective.<br /><br />There are two parts in this film that left me intriguing. First, I can't figure out the title of this movie. It is misleading. Maybe a better title would've been ""The Vanishing Bride"" or something similar. Second, Columbo hides a piece of evidence without offering the reason (to the viewers at least) why he does it.<br /><br />I don't feel betrayed, just disappointed. I'm glad Peter Falk went back to the usual Columbo.<br /><br />",0
"Secret Service agent Jay Killion (Charles Bronson) has been assigned to protect the President-elect's wife, the new First Lady (Jill Ireland). She is a very difficult woman and Killion has his hands full. She is the victim of numerous assassination attempts, all directed by the President's Chief of Staff, who wants the First Lady dead. This movie insults your intelligence with not only the story line, but also with the lack of realistic locations. For example, in the scene depicting the Inaugural Parade, the First Lady is in a Rolls Royce convertible with agent Killion and without the President. Also, we know what Washington, DC, is like weather wise in January, and not only is everybody ""top coat less"", you can even see some palm trees in the 70 degree and sunny weather! (Obviously filmed in Hollywood, not Washington, DC). This movie is a joke. It is not worth your time.",0
"It was a Sunday night and I was waiting for the advertised movie on TV. They said it was a comedy! The movie started, 10 minutes passed, after that 30 minutes and I didn't laugh not even once. The fact is that the movie ended and I didn't get even on echance to laugh. PLEASE, someone tickle me, I lost 90 minutes for nothing.",0
"This movie is full of pseudo deep thoughtfulness and it's cloying in its writerly-ness, that includes a canned ham voice-over and some unbelievable dialogue. Dialogue that is tinny and tone deaf the way Spike sometimes (not always) is when writing ""certain"" characters. For those that like nonsense films like Pieces of April and One Hour Photo, this is another one for you.<br /><br />That said, this comment is nothing against Ryan Gosling who has shown his awesome chops in The Believer. A film that proves that movies are a director's medium, and when a movie is rotten it's fair to say the fault lies there and not in the actors.",0
"David Bryce's comments nearby are exceptionally well written and informative as almost say everything I feel about DARLING LILI. This massive musical is so peculiar and over blown, over produced and must have caused ruptures at Paramount in 1970. It cost 22 million dollars! That is simply irresponsible. DARLING LILI must have been greenlit from a board meeting that said ""hey we got that Pink Panther guy and that Sound Of Music gal... lets get this too"" and handed over a blank cheque. The result is a hybrid of GIGI, ZEPPELIN, HALF A SIXPENCE, some MGM 40s song and dance numbers of a style (daisies and boaters!) so hopelessly old fashioned as to be like musical porridge, and MATA HARI dramatics. The production is colossal, lush, breathtaking to view, but the rest: the ridiculous romance, Julie looking befuddled, Hudson already dead, the mistimed comedy, and the astoundingly boring songs deaden this spectacular film into being irritating. LILI is like a twee 1940s mega musical with some vulgar bits to spice it up. STAR! released the year before sadly crashed and now is being finally appreciated for the excellent film is genuinely is... and Andrews looks sublime, mature, especially in the last half hour......but LILI is POPPINS and DOLLY frilly and I believe really killed off the mega musical binge of the 60s..... and made Andrews look like Poppins again... which I believe was not Edwards intention. Paramount must have collectively fainted when they saw this: and with another $20 million festering in CATCH 22, and $12 million in ON A CLEAR DAY and $25 million in PAINT YOUR WAGON....they had a financial abyss of CLEOPATRA proportions with $77 million tied into 4 films with very uncertain futures. Maybe they should have asked seer Daisy Gamble from ON A CLEAR DAY ......LILI was very popular on immediate first release in Australia and ran in 70mm cinemas for months but it failed once out in the subs and the sticks and only ever surfaced after that on one night stands with ON A CLEAR DAY as a Sunday night double. Thank god Paramount had their simple $1million (yes, ONE MILLION DOLLAR) film LOVE STORY and that $4 million dollar gangster pic THE GODFATHER also ready to recover all the $77 million in just the next two years....for just $5m.... incredible!",0
"On many levels it's very good. In fact, considering that this was a low-budget British indie by a first time feature-director with a largely neophyte cast, it's a magnificent achievement. I don't know how much it cost. The figure of £8,000 was bandied about in publicity but you never know how reliable a figure like that is. The point is that this film looks like it cost a couple of million quid and it clearly cost a tiny fraction of that Great special effects, terrific production design, effective props and costumes, excellent photography, good acting and direction, an impressive score and an absolutely stunning sound mix. Even having said that, much of the script was great. The characters were clearly identified and all had something to do. This is a movie about ten men all dressed roughly the same in one location and it would be easy for them to be nameless, faceless blanks but these were ten characters - mostly that was done through the dialogue and the way they reacted to things. Throughout the middle act, when the plot was developing, the script told the story well and showed how it affected the characters. If the whole film was like the second act, it would be stunning.<br /><br />Before the ship blows up, twelve people make it to individual escape pods or 'e-pods' which blast away from the ship. They're not much more than automatic metal coffins and the poor sods inside are trapped, cramped and have no real idea where they're going - but that makes sense. I like the e-pods - they're an excellent idea done very well and make more sense than a nice, roomy escape capsule. I also like the way that we are specifically told, later, that they are designed for ship-to-ship escape but can just about make planetfall in an emergency - because, let's face it, these guys were bloody lucky that their ship was blown up so close to a planet. That said, it doesn't look to me like there are 116 unused e-pods still on the freighter and you have to wonder how the prisoner is able to get into an e-pod - but in he gets. (And it has just occurred to me: shouldn't the Captain have gone down with his ship rather than being the first guy out of there?) Anyway, the e-pods all land on a barren planet with nothing but sand and sparse vegetation - or at least on a sandy, sparsely vegetated part of the planet which may have icy wastes and lush jungles elsewhere. Nah, it's a planet in a sci-fi movie - it will be exactly the same all over. We have to accept that all the e-pods come down within a few miles of each other so that the ten survivors are able to meet up, firing flares into the sky to locate each other.<br /><br />The Captain, a muscular mountain of a man who could have a pretty good career in action flicks if he gets the right agent, decides that they should try and contact 'Captain Behan' with whom they were intending to rendezvous. But they cannot do this from the planet, they need to get into orbit. The engineer says that if they combine the power units from two e-pods they can probably give one of them enough juice to lift itself on anti-grav doodads high enough to blast above the atmosphere. It can all be done on automatic but it will need a 'pilot' to send the signal. The captain valiantly volunteers for this but in a commendably sensible move the engineer points out that putting the heaviest man into the somewhat dodgily repaired e-pod is ridiculous and that it needs to be the lightest member of the team. That's Kid. I really liked the way that he now points out that his name is David and the Captain starts using it, treating him with dignity and respect. That was good storytelling and good characterisation.",1
"I have done quite a few reviews on IMDb and this film is unique in that I never saw the entire movie. It was so terribly stupid and unfunny that I just couldn't sit through it--though I tried.<br /><br />The biggest problem with this and any Mel Brooks movie I call ""the Mel quotient"". In other words, the better his movie, the less of him you see in the film. Think about it--The Producers and Young Frankenstein were great films and he was barely in them at all. BUT, films like Life Stinks and Space Balls are chock full of Mel and are pretty dopey movies (yes, I DID NOT LIKE Space Balls--but this isn't the place to talk about that).<br /><br />Second, apart from cancer, rectal itch and mental retardation, I can't think of a less funny topic than homelessness. This is just a comedy breaker. Think about it, folks. The FUNNIEST(?) scene in the movie has Mel making whoopee with Leslie Ann Warren in a dumpster!! And this is funny in what way?",0
"This was indeed an amazing adaption. I missed the first episode so I unfortunately missed out on the bonding between the characters and the smooth flow of the storyline. But as soon I watched the second and then the third instalment I was just blown away. I ordered the DVD less than a week later and unable to wait for it to come I went straight out and brought the book. From the moment I opened it I was hooked, I just couldn't put it down. I decided to finish the whole book before I dare watch the DVD at all. I preferred the book because it got inside the characters minds, you could understand totally where they were coming from and what there role was within the story. They missed a lot out of the adaption which was disappointing as the book is a master piece and I think they could have done it superbly if they had been able to stretch it over a longer period of time. But considering only being able to be fitted into a 3 hour slot I think it was done excellent. It followed the main twisted storyline brilliantly. And the actors which were enrolled as the main characters where amazing! The love making scene was pure beautiful. It was so tender and loving and just showed how natural homosexual love can be. I was totally blown away with both the book and the TV adaption! I loved both of Sarah Waters previous novels and also found the Tipping the Velvet adaption quite enjoyable. But when I read and watched Fingersmith I knew none of her previous novels/adaption could beat it. Sarah Waters has indeed exceeded herself this time! I recommend that you watch this adaption! If Tipping the Velvet wasn't your thing, then don't let it put you off this one. Fingersmith is a whole new ball game. It is a beautiful yet dark twisted story about love, greed and betrayal...<br /><br />A MUST SEE!",1
"The show had great episodes, this is not one of them. It's not a terrible episode, it's just hard to follow up ""The man that was death."", ""All through the house"", and ""Dig that cat, he's real gone.""<br /><br />This episode is about a couple that has just been married Peggy (Ammanda Plummer) and Charles (Stephen Shellen). In the first five minutes you find out that Charles only married Peggy for her money. The two go on their honeymoon and their car breaks down on a dirt road and they have to seek refuge in an old abandon mansion. Charles soon finds out a secret of Peggy's family...<br /><br />In my opinion you should watch this episode, but just don't expect the same feeling as the rest of the episodes in the first season.",0
