review,sentiment
"I am writing this with 10 minutes left before the film finishes. I feel comfortable writing it now, because unfortunately I know exactly how this film is going to end.<br /><br />The premise is simple enough, rabid dog on the loose in a small town, kills people. Great - simple plot for a good fun camp 80s horror.<br /><br />Uhh ..no.<br /><br />The main problem is this is based on a book (Stephen King) and you can tell that is should not have really been adapted to film, at least not with the same plot. Why? Cuz its boring! The first 45 minutes tries to build depth to its main characters and create suspense. It however lasts too long (half the film!) - the characters are unlikeable and we never care for them anyway, and it just about creates zero suspense. The easiest film (according to plot and time) to compare this to it the classic Jaws. Everything that Jaws does right, Cujo does wrong. Jaws created good characters and a genuine feeling of dread. Cujo does neither. Jaws effectively creates a scary, creepy villain in its shark. Cujo has a dirty St Bernard running about growling and jumping, and not a lot else. Jaws is exciting and unpredictable. Cujo is a tireless bore that remains predictable right to the end.<br /><br />Also confusing is the plethora of subplots that just act as boring red herrings to the films main plot.<br /><br />If this film was rewritten for the big screen and had a better director this could have been good. But it wasn't. It was a waste of 90 minutes of my life.<br /><br />People on here are saying this is one of the best King adaptations - Im sorry you could not be more wrong. The Mist is a hundred times better, Thinner is 10 times better and even the one with the cats is twice as good! This in my opinion is one of the worst! The only good thing was the action scenes with the dog looked real, even though they were dull.<br /><br />Films ended now, and it didn't get any better. Avoid.",0
"There are plenty of comments already posted saying exactly how I felt about this film so Ill keep it short.<br /><br />""The Grinch"" I thought was marvellous - Jim Carrey is a truly talented, physical comedian as well as being a versatile clever actor (in my opinion). Mike Myers on the other hand gets his laughs by being annoying. I used to like him very much in his ""Waynes World"" and ""So I Married an Axe Murderer"" days - but Ive never been fond of Austin Powers and ""the Cat In The Hat"" has just finished me off. <br /><br />This film was horrible - the gags were horrible! inappropriate for children not only in adult content but in the fact that some of them were so dated they havent amused anyone for 50 years! The plot was messy, messy, messy! Its a shame really because the children were very likeable as was ""Mom"". They probably could have picked a better villain than Alec Baldwin - but he could have pulled it off if it weren't for Myers ugly, revolting over-acted portrayal of the Cat.<br /><br />I mean - did Myers even glance at a script? Was one written? The other actors seemed to have one - but the Cat just seemed to be winging it!<br /><br />On the other hand I would like to mention that the sets and props were marvellous!!! But unfortunately they cant save this film.<br /><br />Poor Dr Seuss - the man was a genius! Dont ruin his reputation by adapting his work in a such a lazy, messy way!!!<br /><br />1/10",0
"Rourke does his usual bit part,as a sinister,rancorous,Neanderthalian,ferocious,evil jerk,in the same mold as in ""Picture Claire"",""Out in Fifty"",""Get Carter"",""Double Team"" and the rest of the garbage he happens to be in.<br /><br />He has very few lines.<br /><br />Of course,all this is just junk,undervaluing Rourke,abasing him,and doesn't matter for his characterization as an actor.Still ,after seeing ""A Prayer ..."",""Johnny Handsome"",""Barfly"",""9 1/2 Weeks"",""Year of the Dragon"",etc.,etc.,for many years I considered Rourke an outstanding,smart,intelligent man.I think he has changed since.<br /><br />He looks callous,calcined.<br /><br />""He went about with gloomy looks;/Despair inhabited his breast/And made the man a perfect pest.""(Belloc,""The Example"").<br /><br />I had absolutely no other reason to watch this dull movie except that Rourke was in.",0
"It is a tricky thing to play a queen. On the one hand, the actress has to be majestic and imperious, and on the other, she has to show vulnerability in a tough situation as well as the gathering of the courage and resolution to overcome the odds, since almost all movies about queens have that basic plot line. <br /><br />Emily Blunt is quite radiant as Victoria, but it's not as full a performance as I'd like, no blame to her. I can't help but feel like this is a Mills & Boon novel adaptation compared to a darker, more dramatic movie about another young queen, Elizabeth. Hence Blunt doesn't get to run the gamut of queenly emotions, at least not to the full extent, since she's, y'know, the young Victoria. To see the old Victoria, check out Mrs Brown.<br /><br />Jean-Marc Vallee is an interesting choice of director for the movie. He last did C.R.A.Z.Y., which was excellent and propelled him to fame. It was quite a different movie but I remember it looking gorgeous and that's probably the main similarity between the two movies. But while Vallee wrote C.R.A.Z.Y., this one was by Julian Fellowes, and though I really enjoyed his Gosford Park, the story for this movie was much less interesting. I soon got lost with all the governmental politics. Maybe it was less engaging because there was no potential beheading of the monarchy. I'm just saying.",1
"THE RAP, the book this movie was 'based' on was one of the most difficult books I've ever read. Yet I could not put it down. Raunchy, crude, foul, lewd...you name it, it had it. It also had some of the best characterizations of any novel I've ever read.<br /><br />Well, as for the flick...it was deplorable. I mean, Tim Mcintire as Wasco? Wasco was the baddest mutha...talking 'bout WASCO...Mcintire as Wasco is like casting Tim Conway as Charles Manson.<br /><br />What happened to the MAIN character in the book? Little Arv. He doesn't even exist in the movie...Fast Walking WAS NOT the main dude in the book. Why even name credit this thing with THE RAP? None of the spirit, atmosphere, nastiness, or drama of the book was captured in this movie.<br /><br />For me it was not only a disappointment, but a total waste of time and celluloid.",0
"I am a chess player and I wanted to like this film. Trouble is, the content could have been fitted in a 30-minute documentary.<br /><br />There were lots of shots of corridors being walked down and Kasparov gazing out in the hall where he won the World Championship. There were other shots of Kasparov being walked round the site of the 1997 match and being told where he sat and where Deep Blue was located. This just looked like filler.<br /><br />Also, I didn't find it interesting to see in detail where Deep Blue was now and seeing an IBM techie trying, unsuccessfully to 'open' it. What would we have seen of interest inside anyway - a little grandmaster?<br /><br />Also, the recent match against Karpov. I no longer follow professional chess enough to know when and where this was. It would have been nice to have been told: was this a one-off 'just for the money'? Was it part of the world championship cycle? What was the final score? The nub of the film was the play in game two. Could/would IBM let Kasparov see 'inside' the machine? That's where the focus should have been.",0
"The Story line for this game is very jerky where it appears the game writers have tried to find ways to justify how a character appears in certain areas of the world map in Tales of the Soul. That being said, this is the only gripe I have about the game.<br /><br />The beginning FMV is spectacular with breath taking sceneries and interesting new devices such as the ability to create and design your own character and their own Martial Arts discipline. There's even a second story mode which makes up for the awkward Story design of Tale of the Souls.<br /><br />Parts of the FMVs during Tale of the Souls is also interactive where you can decide the fate of your Character to a certain degree which is an interesting feature.<br /><br />With the many combinations of Characters you can create, the varied paths you can explore in Tales of the Souls and the Chronicle of Swords story mode, this game will keep any Beatem up/RPG fans amused for a while!",1
"I've enjoyed this movie ever since I first saw it in the theatre. Some movies have a cast of characters and a script that come together in perfect synergy, and this is one of them. The characters illustrate some truths about getting the best out of people, working together harmoniously, building a team and achieving goals, without ever preaching morality. The situations are crafted well and are consistent with the movie's opening premise. The tension builds nicely and the humor is clean and consistent throughout. The movie manages to pull me right in to root for the characters, and to laugh pretty well all the way through. This is a feel good movie as good as they come.<br /><br />What amazes me is that a movie which appears so simple can be so long term entertaining. The music is a perfect copy of music in the typical serious post war navy movies, which helps to create the humor and point out that greatness is in the eye of the beholder. The scenes in the credits are a great music video of ""In the Navy"", which deserve their own full screen special feature. The scenes and cuts are crafted well, and the casting and acting is right on.<br /><br />This movie is a classic as great as any ever made, without any pretensions. In fact, the lack of pretension is what makes it so much fun to watch. I love these guys and gal.<br /><br />The other day I thought of the film, and wondered whether it was available on DVD. Good fortune has come to us, and the DVD came out in May 2004. I headed to the store, and snapped up a copy. Then my wife and I enjoyed another hilarious night in front of the big screen. I've rated this movie as a 10 because it comes together on all levels, far better than many high budget films and Oscar winners. This is entertainment.<br /><br />Listen up Fox home video: you have a great movie in your vaults, and it's a shame to find a cheap shot DVD with badly degraded off tint colors only 8 years since release. So why not restore the colors and present the film as it was meant to be seen? I'd gladly pay a few bucks more to get the picture right. I'm grateful to have my own copy. Now give us the eye candy that the film deserves, and how about recreating the credit sequence as a full screen music video special feature.",1
"This is one of those movies I watched, and wondered, why did I watch it? What did I find so interesting about it? Being a truck driver myself, I didn't find it very realistic. No, I've never used a 'lot lizard', nor have I ever seen, nor heard about one traveling around the country in a brand new seventy thousand dollar RV, either.<br /><br />Same thing about a pimp whom has never sampled the lady in question (until the end of the movie, and well, he still really didn't...), and only getting 50 bucks 'a cut', when the prostitute gets $200.00 (well, $150.00 after his cut, yeah...).<br /><br />I still laugh at the lot lizard comment Ivey made (them's Lot Lizards, they'll screw anything with 20 bucks, and some are men dressed as woman... or something equally as weird), meaning, we're better then them, as we may still be prostitutes, but we get paid BETTER.<br /><br />Other then that, it's just a story of a young woman whom wanted something more from life then a dead end job while living at home (she's 18, remember?) and embarrassed by her mother basically doing the same thing (dead end job). At least she had a roof over her head and a job. She turned FIVE tricks on the road... I wonder if the $750.00 she made was worth it? I'd guess not.",0
"THE FALCON AND THE SNOWMAN is a superb example of an anti-80s film. While many other films of the decade in general lacked substance, this film is pure substance. There's nothing stylish or fake or superfluous about it. It boasts two superb performances: Timothy Hutton and Sean Penn as lifelong friends Christopher Boyce and Daulton Lee, respectively. Hutton, Penn, and Tom Cruise were a triumvirate of early 80s actors who all looked headed to much bigger and better things (all 3 starred in TAPS). While Penn and Cruise's popularity soared, Hutton has been largely forgotten about, and that's a shame. Actually, Hutton is the first of the 3 to win an Oscar for supporting role in ORDINARY PEOPLE in 1980, but I think his performance in this movie is even more outstanding.<br /><br />Hutton really captures the post-Vietnam war rebelliousness in his character Chris Boyce. A failed seminary school student, Chris has a love-hate relationship with his father, well played by the great character actor Pat Hingle. The scene where Chris quotes the poem his father thought he'd long forgotten is a particularly powerful one.<br /><br />Chris gets job at Dept. of Defense and uses his hatred of U.S. gov't and its foreign policy to sell seemingly useless plans of old projects to the Soviets. He gets his buddy Daulton, a hyper drug-dealing self-server, in on it to be the courier of the project plans on microfilm. While Chris is doing it based on his beliefs, Daulton is doing it strictly for the money. The Soviet liaison is excellently played by David Suchet. Penn and Suchet have a real quirky chemistry and it's a kind of funny set of exchanges between them. But, make no mistake, this film is anything but that. It is a serious character study about pessimism, malaise, paranoia and mistrust.<br /><br />Again, the leads make this film. Hutton delivers a brilliantly understated performance as Chris, a rather smart young man who had so much potential. Penn, as usual, does a tremendous characterization as Daulton, a pathetic loser who acts before he thinks, and most of the time doesn't think at all. The ending of this fact-based film is very saddening on several levels. A truly powerful character study.",1
"Directed by Diane Keaton and adapted from a book by Franz Lidz. A young mother Selma Lidz(Andie MacDowell)is battling a very serious illness and her self proclaimed inventor husband Sid(John Tururro)is a little lacking in the emotions department. Unhappy with the new home situation, their sensitive son Steven(Nathan Watt)decides he wants to stay with his two eccentric uncles Danny(Michael Richards)and Melvin(Lou Cutell)until his mom is well. Steven seems to be happier and even takes interest in his strange uncle's living habits; he even decides he wants to change his name to Franz. Set in the early 60's, this drama is a bit comedic...change that to zany. Not being a MacDowell fan, UNSTRUNG HEROES assures my attitude; albeit I enjoyed the film and it is not a total waste.",0
"Having not read the book, I was more open to the fresh interpretation that each director gives to their medium (which is film, not ""to the letter"" reproductions of literature)on this particular film. I was happy that the holocaust that occurred in Russia (and it's neighboring countries) finally received some attention. The Nazis were particularly cruel to Russians and Russian Jews. If you read the histories and see the monuments built in Smolensk and nearby regions you will understand this movie and why many kept silent when they should've spoken up.<br /><br />It was certainly time for this to be chronicled and I hope that more stories will come out of this. It's high time.",1
"The operative rule in the making of this film seems to have been ""never make a 1 minute scene when you can make it a 10 minute scene."" This was a principle set right from the start with an interminably long portrayal of the graduation of the Harvard class of 1870. The point of that scene, I suppose, was to introduce some of the primary figures in the story and give a bit of their background - which is somewhat effective when comparing the idealism of the Harvard graduation ceremony to the realism of life in Johnson County, Wyoming, but it just keeps going and going, and that sets the stage for a film that features repeated stretches of mind-numbing nothingness, made even worse by the fact that I found a significant amount of the dialogue to be almost incoherent. In the end, I couldn't even watch this in one sitting. I got through about half of it and had to set it aside for a couple of days before I could drag myself back to see how it turned out.<br /><br />My reaction to this movie in many ways is a shame, because there are positives here. The performances are generally of a high calibre, especially from Kris Kristofersson as Averill, Christopher Walken as Champion and Isabelle Huppert as Ella. The basic story - interspersed as it is around that ever-present mind-numbing nothingness - is potentially interesting, focusing on the efforts of immigrants to establish themselves in Johnson County and a local cattle company's efforts to stop them by killing a number of them in collaboration with the government and the military. There's also some absolutely breathtaking scenery shots. Having said that, the whole thing could frankly have been done in half the time - and should have been. In the end, all those potential positives are washed out by - again - the mind-numbing nothingness that the movie seems to revolve around. Seriously - 2/10.",0
"1989 was already a year in where Eddie Murphy wasn't that longer hot and started making movies that soon would be forgotten. Funnily enough, it was also the year in where Murphy directed his first film, but it also would be the first and last experiment. ""Harlem nights"" wasn't exactly what you can call a success even if it was great to see the two best black comedians together namely Murphy and Richard Pryor. Don't blame it on the actors as they all played their roles like you expected them do, even if you have to face (again) the typical Murphy-laugh. The worst thing from ""Harlem nights"" are both the scenario and its terrible decors. Everything is set in the roaring twenties and everybody has their profit from the forbidden clubs. Sugar Ray (Pryor) and his adopted son Quickie (Murphy) are gathering easily 10000 dollar per day but of course soon the mob and the corrupt police come around the corner to claim their part of the cookie. Sugar and Quickie aren't guys who give their money for free and have their own plans. You can watch ""Harlem Nights"" that's for sure, but if you puke from the moment you hear the name Murphy you better avoid as after all this movie is nothing but a lame excuse to see some good jokes.",0
"Admittedly, Parsifal is not an opera that can appeal to everyone, although it is a favourite of mine, Knappertsbusch, 1951, in particular. Syberberg's entire approach is so static. Whenever the music suddenly begins to swell ... Syberberg keeps the cast moving at the same pace. The takes on Amfortas and Klingsor are endless. Whatever happened to film editing? The result is physically exhausting to watch. The viewer is never spiritually transported. Your impulse is to rush home and play a recording again to confirm that Wagner got it right, Syberberg got it wrong. And that set decoration with those ""clever"" reminders of Wagner's anti-Semitism -- will there ever be a viewer of this film with no prior knowledge of Wagner?",0
"When I was a kid, I remember watching this while visiting a friend of our ""Uncle"" Phil. We're Back! A Dinosaur's Story is a silly cartoon about a dinosaur called Rex (voiced by the wonderful John Goodman). He tells a little boy dinosaur the story about how the dinosaurs came back to Earth to live. He explains that he was part of the thing that brought them back, along with some friends. The Doctor/Professor villain of this film I think might have been responsible for them being them back, but I don't care about him. The kids might like this, but personally it is just too cheesy. John Goodman was probably the only decent thing. Poor!",0
"During the brief period between Clint Eastwood's string of spaghetti westerns and his Dirty Harry films, he and director Don Siegel teamed up to make this unusual picture. Eastwood plays an injured Union Army corporal during the Civil War who is taken in by a southern school for girls until he recovers from his wounds. It has been a while since the young women (most of which seem to be teenagers) have had a man on the premises, so they are reluctant to turn him in to the local rebel soldiers. The resulting situations are often humorous, shocking, erotic, or even downright grotesque as Eastwood slowly regains his strength and begins to brood over the establishment.<br /><br />The basic storyline almost sounds like the makings of a porno film. We have a masculine male suddenly surrounded by young nubile women. Most of them are sexually attracted to him. And he is more than willing to spread the love amongst them. The material never really slips down to the level of ""tasteless"", however. Eastwood, Siegel, and cinematographer Bruce Surtees are such skilled filmmakers, that the film always retains its dignity.<br /><br />Eastwood's John McBurney is like no other character he has ever played. McBurney is an amoral, conniving, and lustful charlatan. He knows that most of the women, even the youngest want his bod, and he lets more than one of them have a shot at him. McBurney often uses flattery to butter the women up, then uses his rugged good looks to reel them in. He is like a drunken player at a cocktail party, often hitting on different women even in the same scene! Eventually, his lustful ways cause him great agony and loss in a way you must see for yourselves. This author would not dream of revealing the specific consequences of his actions, but there is little doubt he has them coming.<br /><br />Eastwood gives a typically great performance. He seems to be having a blast with the role until things turn really ugly, then he turns mean and ugly. Geraldine Page is a treat as the steely B*tch who runs the school. We know she wants McBurney as much as the other girls, but with her checkered past shown to us in flashbacks, we find out that isn't all she's after! Mae Mercer as a slave belonging to the school gives a great performance, too. She obviously knows McBurney is a skunk from the beginning, and she never lets his phony charm bring her guard down. This is a character you will want to know more about after the film is over. She seems to have a greater knowledge of the world than anyone else in the film.<br /><br />The Beguiled did poorly in its theatrical release. Nobody was quite sure what to make of it, and some of its content no doubt raised a few eyebrows in 1971. For example, in an early scene we see Eastwood romantically kiss a 12-yr-old girl. Is he just trying to keep her quiet when the rebel soldiers get close, or is he really enjoying it? Probably both! A fantasy sequence later on even shows Clint getting it on with not only Page, but her young assistant! Truly some interesting goings on in this one. It's a good thing Eastwood became the star he did, or this one might have been long forgotten.<br /><br />Highly recommended. 9 of 10 stars.<br /><br />The Hound.",1
"I first heard of this film when Patton Oswalt talked about it on his ""Werewolves and Lollipops"" CD. He said it was a lost classic that is completely ridiculous. Being a lover of terrible cinema, I knew I was in for a treat.<br /><br />This film is, hands down, one of the weirdest I've ever seen. Certainly one of the weirdest shlock films. Basically, a demon took human form years ago for a woman, the woman died or something, the demon cried blood, the blood fell on the bed, the bed is now possessed and it now eats. Along with fruit, flowers and chicken, it also has a taste for people. The people can range between horny teens, mayors, gangsters, servants or professional orgy throwers. There's also a sick guy who the bed ate but put his soul behind a picture in the room.<br /><br />Most movies let you figure out the plot through exciting action. Death Bed takes another path: it basically tells you through narration exactly what's happening while slow, dull murder scenes take place. Also, I must say everyone who's eaten by the bed are surprisingly quiet. I would think if a bed is eating you through the ways of a 5th grade science fair experiment, it would sting a little. I guess nerve endings weren't invented until 1981 or so.<br /><br />The story is wacky, the direction is slow and pretty awful, the sets are sparse, the acting it fairly painful and the brother is one of the unintentionally ugliest actors I've ever seen. Probably would make a great party film if alcohol and smart-asses are involved. Certainly one you shouldn't miss.",0
"I wish I would have read more reviews and more opinions about this movie before I rented it. A waste of money. A waste of time. Very little dialog. The dialog was hard to understand in every way. The storyline and plot were both weak. The only thing that was nice at all was the cinematography.<br /><br />The characters were interesting. At the same time you will spend so much time trying to figure things out, because of the lack of dialog, that you will be rewinding the movie a lot. <br /><br />Do not watch this movie. It was a mess and will leave you feeling like a mess.<br /><br />You will say, what the heck was that, when the movie ends?",0
